{
  "projectId": "PRJ-2026-OAKRIDGE-MEDICAL",
  "revision": "Rev C",
  "trade": "mechanical",
  "csiDivision": "23",
  "lineItems": [
    {
      "id": "LI-001",
      "description": "Rooftop Unit, 25-ton, high-efficiency",
      "quantity": 2,
      "unit": "EA",
      "size": "25 ton",
      "material": "packaged-unit",
      "specSection": "23 81 26",
      "sourceSheet": "M-101",
      "location": "Roof Level",
      "alternates": [
        {
          "description": "Carrier 48HC",
          "manufacturer": "Carrier",
          "partNumber": "48HC-A28"
        }
      ]
    },
    {
      "id": "LI-002",
      "description": "Copper pipe, Type L",
      "quantity": 850,
      "unit": "LF",
      "size": "2 inch",
      "material": "copper",
      "specSection": "23 21 13",
      "sourceSheet": "M-201",
      "location": "Level 1-3 Risers"
    },
    {
      "id": "LI-003",
      "description": "Butterfly valve, lug style",
      "quantity": 24,
      "unit": "EA",
      "size": "4 inch",
      "material": "cast-iron",
      "sourceSheet": "M-301"
    }
  ],
  "metadata": {
    "generatedBy": "pelles-takeoff-agent-v2",
    "generatedAt": "2026-02-28T10:30:00Z",
    "confidence": 0.92,
    "sourceDocuments": [
      {
        "filename": "Oakridge-Medical-HVAC-Plans.pdf",
        "sheetId": "M-101",
        "revision": "C"
      },
      {
        "filename": "Oakridge-Medical-HVAC-Plans.pdf",
        "sheetId": "M-201",
        "revision": "C"
      }
    ],
    "flaggedItems": [
      {
        "lineItemId": "LI-001",
        "reason": "Verify tonnage \u2014 spec says 20-ton but plan detail shows 25-ton",
        "severity": "warning"
      }
    ]
  }
}
